{
  "$schema": "http://json-schema.org/draft-07/schema#",
  "$id": "https://schema.getpostman.com/json/draft-07/collection/v2.1.0/",
  "type": "object",
  "properties": {
    "info": {
      "$ref": "info.json"
    },
    "item": {
      "type": "array",
      "description": "Items are the basic unit for a Postman collection. You can think of them as corresponding to a single API endpoint. Each Item has one request and may have multiple API responses associated with it.",
      "items": {
        "title": "Items",
        "oneOf": [
          {
            "$ref": "item.json"
          },
          {
            "$ref": "item-group.json"
          }
        ]
      }
    },
    "event": {
      "$ref": "event-list.json"
    },
    "variable": {
      "$ref": "variable-list.json"
    },
    "auth": {
      "oneOf": [
        {
          "type": "null"
        },
        {
          "$ref": "auth.json"
        }
      ]
    },
    "protocolProfileBehavior": {
      "$ref": "protocol-behavior.json"
    }
  },
  "required": [
    "info",
    "item"
  ]
}