{"info":{"name":"https://run.mocky.io","_postman_id":"97c7d9d6-6c1c-4f74-857d-8abf5949f2f0","schema":"https://schema.getpostman.com/json/collection/v2.1.0/collection.json"},"item":[{"name":"GET","variable":[],"event":[],"request":{"url":{"query":[{"key":"a","value":"1","disabled":false}],"variable":[]},"auth":{"type":"basic","apikey":[],"awsv4":[],"basic":[{"key":"username","value":"test","type":"string"},{"key":"password","value":"test","type":"string"}],"bearer":[],"digest":[],"edgegrid":[],"hawk":[],"ntlm":[],"oauth1":[],"oauth2":[]},"method":"GET","header":[{"key":"x-str-test-header","value":"sdafghjhk","disabled":false,"description":""},{"key":"x-some-test-header","value":"123456","disabled":false,"description":""},{"key":"x-json-test-header","value":"{\"a\":\"b\"}","disabled":false,"description":""}],"body":{"mode":"raw","raw":"","urlencoded":[],"formdata":[],"options":{"raw":{"language":"json"}},"disabled":false}},"response":[]},{"name":"POST","variable":[],"event":[],"request":{"url":{"query":[{"key":"x-test-json-header","value":"{\"a\":\"b\"}","disabled":false},{"key":"a","value":"","disabled":false}],"variable":[]},"auth":{"type":"basic","apikey":[],"awsv4":[],"basic":[{"key":"username","value":"test","type":"string"},{"key":"password","value":"test","type":"string"}],"bearer":[],"digest":[],"edgegrid":[],"hawk":[],"ntlm":[],"oauth1":[],"oauth2":[]},"method":"POST","header":[{"key":"x-test-header","value":"123456","disabled":false,"description":""},{"key":"x-test-json-header","value":"{\"a\":\"b\"}","disabled":false,"description":""},{"key":"x-str-header","value":"asdfg","disabled":false,"description":""}],"body":{"mode":"raw","raw":"{\"someField\": \"SomeValue\"}","urlencoded":[],"formdata":[],"options":{"raw":{"language":"json"}},"disabled":false}},"response":[]},{"name":"PUT","variable":[],"event":[],"request":{"url":{"query":[{"key":"x-test-json-header","value":"{\"a\":\"b\"}","disabled":false},{"key":"a","value":"","disabled":false}],"variable":[]},"auth":{"type":"basic","apikey":[],"awsv4":[],"basic":[{"key":"username","value":"test","type":"string"},{"key":"password","value":"test","type":"string"}],"bearer":[],"digest":[],"edgegrid":[],"hawk":[],"ntlm":[],"oauth1":[],"oauth2":[]},"method":"PUT","header":[{"key":"x-test-header","value":"123456789","disabled":false,"description":""},{"key":"x-test-json-header","value":"{\"a\":\"b\"}","disabled":false,"description":""},{"key":"x-str-header","value":"asdfghj","disabled":false,"description":""}],"body":{"mode":"raw","raw":"{\"someField\": \"SomeValue\"}","urlencoded":[],"formdata":[],"options":{"raw":{"language":"json"}},"disabled":false}},"response":[]}],"event":[],"variable":[]}